{
  "contract_version": "1.0",
  "python": "/usr/bin/python3",
  "deploy_root": "/opt/harness",
  "temp_root": "/var/tmp/harness",
  "data_root": "/srv/data",
  "models_root": "/srv/models",
  "worktrees_root": "/srv/worktrees",
  "harness_version": "0.01.000",
  "deployed_from": "CAOS_AGENTIC_HARNESS@v0.01.000"
}
